{
  "templateName": "Node 原生 · 原生路由",
  "templateId": "{{TEMPLATE_ID}}",
  "framework": "node",
  "description": "纯 Node.js http.createServer，无框架依赖，演示 URL 路由匹配与手动 fs 静态托管。",
  "icon": "🟢",
  "category": "starter",
  "entry": "server.js",
  "rootDirectory": "/backend-tests/node",
  "deployUrl": "{{DEPLOY_URL}}",
  "demoUrl": "{{DEMO_URL}}",
  "tags": ["node", "原生", "零依赖", "路由"]
}
